{
  "version": "4",
  "groupKey": "incidentd-webhook/{alertname=\"LatencySLOBurn\"}:{cluster=\"lab-eu-west\", service=\"checkout-api\"}",
  "truncatedAlerts": 0,
  "status": "resolved",
  "receiver": "incidentd-webhook",
  "groupLabels": {
    "alertname": "LatencySLOBurn"
  },
  "commonLabels": {
    "alertname": "LatencySLOBurn",
    "cluster": "lab-eu-west",
    "environment": "lab",
    "instance": "checkout-api-7d9f8c:8080",
    "job": "checkout-api",
    "service": "checkout-api",
    "severity": "critical",
    "slo": "checkout-availability-99.95"
  },
  "commonAnnotations": {
    "summary": "checkout-api is burning the availability SLO budget",
    "description": "5m error-budget burn rate 14.2 on checkout-availability-99.95; p99 latency 1.8s vs 400ms target, 3.1% of checkout requests failing.",
    "contributing_factor": "slow-path recommendation call enabled for all traffic (feature flag rollout at 12:58)",
    "runbook_url": "examples/playbook/README.md#checkout-api"
  },
  "externalURL": "http://alertmanager.lab.local:9093",
  "alerts": [
    {
      "status": "resolved",
      "labels": {
        "alertname": "LatencySLOBurn",
        "cluster": "lab-eu-west",
        "environment": "lab",
        "instance": "checkout-api-7d9f8c:8080",
        "job": "checkout-api",
        "service": "checkout-api",
        "severity": "critical",
        "slo": "checkout-availability-99.95"
      },
      "annotations": {
        "summary": "checkout-api is burning the availability SLO budget",
        "description": "5m error-budget burn rate 14.2 on checkout-availability-99.95; p99 latency 1.8s vs 400ms target, 3.1% of checkout requests failing.",
        "contributing_factor": "slow-path recommendation call enabled for all traffic (feature flag rollout at 12:58)",
        "runbook_url": "examples/playbook/README.md#checkout-api"
      },
      "startsAt": "2026-03-04T13:02:10Z",
      "endsAt": "2026-03-04T13:49:10Z",
      "generatorURL": "http://prometheus.lab.local:9090/graph?g0.expr=LatencySLOBurn",
      "fingerprint": "4a7d9eb30581fff8"
    }
  ]
}
